title,size,color,rating,review_text
I expected more,8,"Camel Brown, Black",3.0,"I had high hopes for these since they are Sorel's and cost more than other comparable boots. I received them the day before we received 9"" of snow. I usually wear a 7 1/2 in shoes so ordered the 8 since most of the reviews stated they ran small. They were too big even with thick socks. I pulled a set of insoles out of an old pair of tennis shoes and that helped. It also added some cushion since the insoles that came with the boots had ZERO. There is also no insulation so my feet got cold in the snow. I don't think they're rated as ""winter boots"" so I didn't mark them down on that. The reviews about the extra material on the tongue pressing into the top of the foot were spot on. It is uncomfortable but am hopeful it softens up after more wear. I might just cut that little triangle of material out. I was also disappointed there was no cushioning around the ankle. Since we were getting all the snow and I had no other alternative to wear to walk the dog, I kept them. They are waterproof so that is good. If we weren't going to have the snow, I would've returned them. They will work for what I want them for (walking the dog in the rain) but was hoping for something better for the brand name and price."
Nice boots!,8.5,"Taffy, Black",5.0,"I got the 9 as 8 1/2 seemed just a bit small. So comfortable, wore them on a little 5 mile walk/hike right away and they were great. I love them and wear them all the time. I would but again and highly recommend."
Super cute!,9,"Camel Brown, Black",4.0,"I debated for the longest time whether or not to get 8.5 or 9 being I’m in between the two. I went off reviews and ordered bigger and got the 9... I’ll be returning for the 8.5. Hoping they break in good, they feel pretty rigid right now. Overall though, super cute & can’t wait to wear them!"
So uncomfortable,8.5,"Camel Brown, Black",2.0,"I’m usually a Sorel fan and these are super cute but really uncomfortable which was surprising. The tongue is too short so the laces are up against your ankle and the tops are stiff, which I didn’t expect. Because of the short tongue, I don’t see how your foot would stay dry or warm. I’ll use these for short walks with the dog around the neighborhood, no long walks, no hikes."
A nice slip-on everyday winter boot,9,"Omega Taupe, Black",4.0,I really like the way these look! I do have to wear thicker socks for them to feel really comfortable. I’ve got them tied perfectly so I just slip them on and off. Good in the snow and rain. I’m happy with my purchase and would definitely recommend.
Perfect,11,"Dove, Sea Sprite",5.0,Nice to find a winter boot that looks good
Love em,10.5,"Taffy, Black",4.0,Love these boots. I got them after a pair of Bearpaws broke down in less than a month and am so happy I decided to splurge on these 🙌 love em
Comfortable and Stylish,10,"Omega Taupe, Black",4.0,"I ordered these for our trip to Ireland since it’s known to rain a bit. I needed shoes that were waterproof, comfortable for hiking, and stylish. I give them the higher rating for stylish and waterproof but I’m not sure how they will be on the long treks. While comfy they don’t seem to have great arch support. Four out of five on comfort. I did order a size up based on reviews and they fit perfectly."
Go Up ½-1 Size,NA,NA,5.0,"I just got them today, but even without socks they seem quite small to previous Sorels. For context I'm a US 9, but I've taken to buying US 9.5 so I don't have to break in shoes. Sorel's I've always had to go up half a size, but I took one look at the rubber and decided to go for a US 10 (which happens a lot on boots for me, so still a norm) and I'm glad I did! I'll try to update my review, but on cursory glance, best go up ½ or 1 size.

Update 1 Sep 2022: I would definitely start a full size up on these shoes. During winter with thick socks these feel small if I'm on my feet all day. They've held up well & for Seattle they're a great shoe for daily wear (with insoles), but because of the rubber, you can't break them in ever. It's good. They do exactly what they're supposed to do, get them!"
Not comfortable,9,"Stone Green, Black",2.0,"I know lots of people love these boots. I did not find them comfortable. They hurt my feet after wearing them for a day. Also, they run small. I would size up one size."
Style is so cute! Glad I went a half size up! Came with a couple marks.,7,"Camel Brown, Black",4.0,I love the look of these! I tried them on with thick fuzzy socks and fit just right! The only thing I would say is for the money spent they should come without what looks like a white paint drop on one of the toes. And has a weird small “stain” on the front of the tan fabric. Other than that I love them!
Very comfortable and warm,7.5,"Camel Brown, Black",5.0,"Love love love these shoes. Purchased to have warm and waterproof boots practical enough for daily wear if needed. These are perfect!! These shoes are very comfortable, easy to get on, cute, keep my feet warm and dry. True to size. I typically wear 7.5 or 8. I purchased a 7.5 and they fit great even with a thicker sock. I will be ordering other colors!"
My new favorite boots!,8.5,"Taffy, Black",5.0,"I’ve lived my whole life in So Cal and never put much thought into buying waterproof boots, let alone ones that I can walk in all day.

Well I saw these in real life and thought they were really cute and decided to look them up. After being talked out of buying several pair I settled on the tan and black ones. It ended up raining a few days after I bought these so I saw that as the perfect opportunity to take these on a test drive.

After about a full day of wear I love that they have a little bit of a heel (not much), they are beyond comfortable to walk around in, and they are very much waterproof. I’m a women’s 8.5 and I can wear medium to thick socks and they still feel comfortable."
Quality. Style. Comfort.,NA,NA,3.0,The pull on tab is broken.
Best waterproof boots!,7,"Camel Brown, Black",5.0,"The boots are extremely comfortable. I use a hard plastic insole inside for arch support but even without the insoles, the boots are still very comfortable. I was skeptical about the felt fabric being waterproof but I was quickly proven wrong. The whole shoe is waterproof and help up great so far in pouring rain. The colors are beautiful and compliment each other well. These boots go with practically everything. They are much lighter than my other waterproof hiking boots by LA Sportiva. I bought a size 7 and normally wear a size 7 shoe and it fits true to size. I have a little room for thicker socks but they are just as comfortable with thin socks too. Great shoe and I would definitely recommend! Shipping was also faster than anticipated."
Great boot,9,"Dove, Sea Sprite",5.0,"I really like these and that they are waterproof. They are comfortable but not a ton of support- I considered getting an insole. I live in a mild climate where its cool and rainy in winter so they are plenty warm for me. I did read a few reviews saying to size up. I normally wear an 8.5 and I bought a 9, and I think an 8.5 would've been better, but I didn't want to mess with a return/exchange. They work but there's more wiggle room than I really need."
Uncomfortable and unsupportive,8.5,"Camel Brown, Black",2.0,Super cute just like the pictures! However the tongue of the shoes was sewn twisted on both shoes and they were very uncomfortable. It felt like it tilted my foot strangely to the side and was too wide with no arch support. Returned.
Good Buy!,8,"Camel Brown, Black",5.0,LOVE the look of these boots! I have a wider foot but my normal size fit Great! They are warm on a cold Midwest day with my wool socks. I will have to wait to see how well they hold up during my upcoming Alaska trip! I bought 2 pair to see which color I liked best- now I want BOTH pairs!!!!
"Large, slips off easy",9,"Camel Brown, Black",3.0,"It is taking me a long time to get used to these, I want to love them because they are so darn cute. They fit very wide and large, if you don’t wear thick socks they tend to slip as you walk. They’re not super comfortable either.."
Soles separated,7,"Dove, Sea Sprite",2.0,I only wore a few times and the soles started to separate already.
Little slim for wide feet. Very warm!,8.5,"Camel Brown, Black",5.0,"Wore them to a trip to New York City over Christmas. Miles of walking each day and the only complaint I have is that if I wore two layers of socks, then one shoe fell a little snuggle for my pinky toe. They actually were warm enough to only wear one layer of thick socks. It rained almost the whole time and I never felt wet at all! I truly love these!"
Comfy & cute,8,"Camel Brown, Black",5.0,I bought these boots for an upcoming mountain trip and I’m in love with them!!! So cute and very comfortable and waterproof!
Mostly do the job,5.5,"Stone Green, Black",3.0,"I’d size up as they run tight. They do the job because they work as a waterproof winter boot in the snow without being bulky. I like the look too. However, they’re not the most comfortable boot. I replaced the inserts with some that provided some arch support and that’s helped a bit."
Sorel boots,9,"Camel Brown, Black",3.0,"The quality is excellent. I think I should’ve went up a half size. Sometimes my feet swell. But, they are nice."
Runs small,11,"Camel Brown, Black",5.0,Luv luv BUT runs small. I bought my size 11 but needed the 12. Maybe that is why they make a size 12 because they know the 11 is not long enough.
Boot size,NA,NA,2.0,The boots I ordered ran very small. I could barely get my feet into them.
Not very comfortable or warm,6,"Omega Taupe, Black",2.0,They don't make them like they used to. Very little insulation and not very comfortable. They look good but that's all. Very disappointed.
Disappointed,9,"Camel Brown, Black",2.0,I've only had mine for about 60 days and the rubber sole is separating
Very uncomfortable,10.5,"Camel Brown, Black",1.0,Product looked worn and creases thruout the boot tounge. Looked very defective. Sending back.
Fell apart after 15 wears,7,"Taffy, Black",1.0,Paid $200....falling apart after about 15 wears
Sole is detaching after 4 wears.,NA,NA,1.0,"The bootie is so cute and comfortable! I got a lot of compliments the couple times I wore them out shopping. I’ve only worn them 4 times… the sole is detaching from the shoe. I don’t know if I got a bad pair or what, but these would never withstand doing real work. Reaching out to seller. If reimbursed or replaced with a shoe that doesn’t fall apart I’ll change my review. These shoes are too expensive to fall apart."
Run small,6,"Fawn, Sea Salt",2.0,I always wear a 6 and these wear about a 1/2 to whole size too small
Broken shoe lace strap,NA,NA,1.0,"I honestly loved these but after wearing them ONE time in non-rain/snow weather, the shoe lace strap broke off. So disappointed. Just returned."
Perfect for everyday wear,10,"Omega Taupe, Black",5.0,I love these boots. They are super comfortable so you can wear them all day. They’re lightweight like tennis shoes but will keep your feet warm. My feet always run cold and these are perfect for winter weather. True to size.
Uncomfortable and not durable,NA,NA,1.0,"I kept thinking that I could “break” them in and they wouldn’t hurt to walk or stand in, that never happened. Also…within 2 months time of limited wear, the sole started to peel away on the toe. These were too expensive for the product that I received."
Uncomfortable and not warm,7,"Camel Brown, Black",1.0,"I was so.bummed when I were these on a cold day to learn how uncomfortable and cold these were. The price is only for the logo, not quality craftsmanship."
Run a little small I'd size up 1/2 size,7,"Omega Taupe, Black",5.0,I'm so bummed I ordered 7 they are so cute but alittle small ..no 7.5 avaliable
Super uncomfortable!,NA,NA,1.0,"These boots are REALLY uncomfortable! No cushioning inside and super stiff. Hard to get off and on. Would NOT recommend, and now I’m stuck with them because the return window is really short"
Very uncomfortable to wear.,10,"Taffy, Black",1.0,These are not comfortable and hurt my feet. I was disappointed. This brand has always been comfortable.
Runs small,7.5,"Omega Taupe, Black",1.0,Too small
Terrible quality,9,"Black, Grill",1.0,I’ve only worn these about ten times since purchasing last spring. The rubber came away from the boot at the toes and let’s water in. I can’t believe how poor quality these were especially given the brand and price. They ran small which may have contributed but not so small my feet hurt. Can’t say if they are known offs or not. Return period is over and im max/sad
Not for daily wear,8.5,"Dove, Jet",3.0,I love my boots so much they are almost a daily wear for me. They are cute and comfortable. Im sad that about 9 months they started falling apart. For a pricy boot I didn't expect this. They are true Sorels and the rubber on my left to is peeling back. The seam by the insole on the right boot is also coming apart. I noticed recently that the rubber covering the toe is cracking. IF I get another pair they will not be daily wear… But that will be difficult for me.
Order half size up even if other Sorels fit in your usual size,8.5,"Omega Taupe, Black",4.0,"I was annoyed with myself for not listening to the other reviews. I wear a size 8 in every shoe brand, including Sorel (I own 3 other pairs of Sorels) so I was sure the other reviewers were wrong when they said to size up. They were right. Size 8 fit, but when walking, my big toe was jammed up into the front of the boot. I could probably make it work, but very uncomfortably, so I just re-ordered an 8.5 which I think will be perfect. This will be the only size 8.5 shoe I own, so listen to the other reviewers and order 1/2 size up."
Only lasted one season 😢,10,"Camel Brown, Black",1.0,I loved these boots until they split open (see pic). They were comfortable and water proof. But I took them out to wear again this fall and they are split. Super disappointed since I spent $200 at REI to get them. Save your money and get something that will last longer than 1 winter.
Scammed,NA,NA,1.0,"I spent way too much money on sorel boots to have them split wide open.
I was cheated and scammed for my money"
Love them but cause stinky feet,NA,NA,2.0,"I love these, but they make me feet smell. I have tried several different types of socks, and same result. I have the black and wool ones, and those are fine. Not sure what’s up with them, but they look cute."
Sole became unglued after just a few dozen wearings,7.5,"Black, Grill",2.0,Otherwise I loved these little boots. Ran true to size.
Very uncomfortable,10.5,"Black, Sea Salt",1.0,I liked the style but they were extremely uncomfortable and no support or all. Make sure to get half size larger my toes touched the top of boot.
Nice,11,"White, Cyber Yellow",3.0,Just hurt my bunion . So it had to go!!
"Returned, but ordered a dofferemt size!",10,"Dove, Sea Sprite",5.0,"I ordered the wrong size! So often my feet are a liittle too big for the size I think I should order, but these are not. I have reordered the next 1/2 size smaller, can't wait for them to get here. They seem very well made, and exactly what I want. I have a pair of Sorels for heavy duty walking in snow, etc, these wil give me a nice option when there isn't quite so much snow."
These are so cute!,9,"Taffy, Black",5.0,"Play Video
 I live in New England, boots are required if you spend any time out side. You can tell yourself you don't need another pair or you just ask yourself do I have a cute functional pair? These are great out and about boots, no I would not wear these to shovel or expect them to be the warmest pair I own, but perfect for keeping my feet dry and not weighing 25 pounds a piece."
Nice boots,10,"Camel Brown, Black",5.0,"These are really well made boots, but a little “short”. Size 10 normally gives me plenty of room, but while these have a nice wide toe box, my toes touch the front of the boot."
So many compliments!,8,"Camel Brown, Black",5.0,"The name Out 'N About suits this boot perfectly!

I received so many compliments on these on a recent trip to Colorado.

I just ordered a pair of high top Sorel sneakers. I can't wait to get them!

I did give the support 4 stars BUT not because of the shoe. I have planters fasciitis so my so for me to give something a 5 in that area is almost impossible."
Best bid boots ever,8,"Omega Taupe, Black",5.0,"I LOVE these.

They are very waterproof. Could use some insole support if you have high arches and walk a lot. Not for mud or heavy hiking but they're perfect for grocery shopping and running errands in the winter. I wore them 5 days straight in mud and rain and after wiping them down they still look new. They go well with jeans and leggings. My favorite boots for winter casual"
"Awesome boots, runs large",8.5,"Taffy, Black",5.0,"Love these boots, they run large, eve. With heavy socks so I ordered an 8.5, my true shoe size, and there is plenty of room for thick socks. Very comfy, sturdy, water proof"
Not as narrow as other styles,9.5,"Camel Brown, Black",5.0,I really like this lower boot! It’s comfortable and it is a little bit wider of a style than other Sorel boots. Plus it’s really cute
Comfortable and sturdy,11,"Camel Brown, Black",5.0,These boots look great! They keep your feet warm! They are comfortable and sturdy enough to hike 6 miles up a mountain in. Love the looks and received so many compliments
Love sorels,8.5,"Omega Taupe, Black",5.0,Love these boots.. ordered a half size up for thick socks... These aren't lined so if you live in the tundra you will need some thick socks... That being said... Little tight around the ankle but toes have plenty of room and they will stretch out a little ... I love them... My plantar fasciitis isnt bothering me at all... Because there aren't anyy inserts in them either.... I tried some from my hey dude's shoes.... And they actually hurt... I know .. makes no sense at all .. but that's my story and I'm sticking to it .. good luck and get outside!!
Don’t delay!!,8,"Camel Brown, Black",5.0,"If you’re thinking of buying these shoes, don’t delay! Just do it. They are the most perfect casual/winter boot to have for the fall. Comfortable. Can wear with think or thin sock. I wear a size 8 and bought an 8. I do not have a wide or narrow foot, so the fit is perfect for me. They were expensive, which is why I hesitated, but now that I have them, I love them!! Worth the buy and great quality boot. Great with jeans, leggings, shorts and causal rompers."
"Cute and water proof, not warm.",9.5,"Camel Brown, Black",5.0,These boots are super cute and keep my feet dry which is what I was aiming for. They are absolutely not warm for the toes. Not much insulation in the toe area. I sized up a half size which I was glad I did. They didn’t feel all that comfortable when I first put them on but have since gotten more comfortable. I like them but they are not a winter boot.
Solution for the tongue,8.5,"Camel Brown, Black",5.0,I have skinny ankles. There was pressure on the front of my ankle as I’m walking. Tying the laces behind the tongue allows for me to get a tight fit around my ankle and eliminated any pressure any where on my ankles. I’ve not worn them out yet but the color scheme is so me and will go with anything! They are comfortable just walking around the house and on the treadmill to try them out longer before deciding on them. I’m very excited to have figured this out so I can keep them. I’m an 8.5 in most shoes and the last sorels I bought were that size. They fit perfect.
Guys… order a pair for your SO ASAP,9,"Camel Brown, Black",5.0,These are better than any other girls boot in the market. Skip the Ugg’s or Sperry’s and try these first. Ever since I bought these my wife loves me more
Order half size up,9,"Black, Grill",5.0,"Perfect dogwalking shoes for muddy parks in the rainy months. Returned the size 9 shoes I usually wear, but the 9.5 were a great fit. Consider ordering half a size up."
Comfy,7,"Dove, Sea Sprite",5.0,Love these. Looks good and fits well. Love them.
Oh yes!,NA,NA,5.0,"I opted for these boots - who can go wrong with Sorel? - after another pair of Columbia boots were just to warm. These are good looking as well as comfortable. I may use pedi socks inside or perhaps without socks all together. I have big feet - women's 11.5-12 and often feel like I'm lugging boats on my feet...nothing graceful about it. Yet these boots make me feel graceful and they even walk well, like a shoe, not a boot. So happy I found them. I got the grey wool which offers a nice clean up look. They are a bit pricey but arrived when promised so I'm ready for winter!"
Amazingly comfortable,9.5,"Camel Brown, Black",5.0,"I am a athletic shoe wearing girl. That’s pretty much all I wear. I needed a good waterproof shoe that I could wear with regular jeans and skinny jeans. When the weather is wet here in western Oregon, I hate having my toes soaking wet through my shoes. I bought these and actually had to buy 3 pairs to get the right size. I own a pair of Sorel caribou boots and they are 9s so I went with that but they were too small. I ended up with a size 10 after a couple returns. These are the most comfortable shoes, they fit perfectly with my insoles as well!"
Excellent boot,8,"Taffy, Black",5.0,Love everything about these boots. Although I typically wear a 7.5 and had to return and size up to an 8 with these so they may run a tad small
I love them,6.5,"Camel Brown, Black",5.0,"I don’t normally spend a lot of money on shoes but this was worth every penny! They are the perfect casual boot for fall/winter. They keep my feet warm and dry. They go with so many outfits!
I don’t tie them tight because it does do something weird to the tongue and can be a little uncomfortable, but even with them tied loosely they don’t slip off when I walk.
I loved them so much I just bought some dressy sneakers from the same brand and I love them too."
I had to add a insole but I love them,7.5,"Camel Brown, Black",5.0,I have gotten so many compliments on these when I wear them they fit good except I did add a softer insole I wear a 7 I ordered a 71/2
"Good Quality, go half size up",8.5,"Black, Grill",5.0,"Love these boots, really sharp looking. They keep your feet dry and so far, have given good traction in the slush and snow.
I read that Sorel tends to run small, so I ordered a full size up, anticipating wearing wool socks with these boots. They are a bit big, but fine for what I need. I would only go up a half size, if at all.
Ideally, I wanted to wear these boots with leggings and wool socks. The boots are a little shorter than I expected so the wool socks come up a little higher then I'd like. I thought they would lace up higher on my leg as well, but are easy to slide on and off since they don't."
Size up a whole size,10,"Camel Brown, Black",5.0,"These are definitely my favorite boots! I was really frustrated with how many times I had to order them to get the right size though. How is it possible that I wear a 9 in ALL other brands and types of shoes/boots, but these I had to size up a whole size?? Other than the pain in the neck of sending back the size 9 and the size 9.5, to finally get the size 10, these are great boots. Highly recommend getting them, just wish Sorel could get the sizes right. Size up!"
Love these,7.5,"Camel Brown, Black",5.0,I love these and wear them all the time. It so nice to have something waterproof that can be worn for so many reasons
How can you say anything bad??!!!,9,"Taffy, Black",5.0,"They are an athleisure bootie. They aren’t meant to go skiiing or romping through the snow but are my everyday bootie to work and school, so cute and comfy!! I’d say as water resistant as a shoe maybe a tad more. SO CUTE, I get compliments all the time. It snowed today in Wisconsin, yes Oct. 14th and these made it a little better. ;)"
Not real sorel boots,8,"Camel Brown, Black",5.0,I bought these sept 24th 2022 and wore them about 10 times and the toe is already busted opened. I work with kids so I'm not doing a lot in these boots and I've never ever ever ever have had this problem with sorel boots I've bought from a department store. But these that I bought online are NOT durable. DO NOT BUY
Great quality and comfort,7.5,"Black, Sea Salt",5.0,"Bought these for my wife, she loves them, very comfy, stylish and waterproof. She likes to wear thick socks so I bought half size larger than the size she normally wears which worked well for her"
Super cute!,10.5,"Camel Brown, Black",5.0,"Super cute Sorel boots!! They could use a little more cushion I think. Feet ache a bit after wearing and being on my feet all day in them, but style over comfort - am I right? ;). The s in the bottom on the inside of one of them has wore off already and it’s been about 2 1/2 months of having them, but I’ve worn them pretty steady and like I said, am on my feet all day when wearing them. Super cute boots!"
LOVE THESE BOOTS,NA,NA,5.0,"I love everything about these boots! Color (creamy white) is very nice. I wear a 7 1/2 to an 8, and I have a wide foot at the front. Bought an 8 and they are the perfect fit. Very comfortable!!!! Almost makes me excited for the snow."
Super Cute runs small,8.5,"Taffy, Black",5.0,Really cute and comfortable. They do run small. I usually wear an 8 in boots and 39 EU are usually way roomy enough. I got an 8 1/2 in these and they are snug and toes touch the front
I'm in love,7.5,"White, Cyber Yellow",5.0,New favorite boots! They fit very well (sometimes sorel is too big or small depending on style but not these).
