title,size,color,rating,review_text
Best snow and rain boots,7.5,"Camel Brown, Black",5.0,I've gone too long without boots and decided to try these. They are so comfortable and looks great with everything. I read other reviews and was glad I did as I'm always a 7 but did size up to a 7.5 and they fit perfect. Size up half a size. I do have narrow and flat feet fyi. But the toe box narrows so if you don't size up then you will end up exchanging.
Cute!,8,"Camel Brown, Black",5.0,"Love the look of these shoes. I had been keeping my eye on them for a long time and snagged them on sale for Black Friday. They do not have a lot of cushion which kind of surprised me. I have to wear tall, thicker socks for them to be comfortable enough. I would buy them again as I really think they are cute. Just something to consider if the cushion is an issue for you."
Love them BUT,9,"Taffy, Black",4.0,"So don’t get me wrong. I love them. Wear them every single day in the fall/winter/spring. Waterproof. I let the laces loose so I can just slip them on and run out the door with my boys. HOWEVER, I am disappointed with the lack of “squish” on the inside. Like there’s noooo support really at all. So when you’re standing at a kids game they can get a little uncomfy just bc of the lack of support. I guess I could add insoles but for the price tag I’d expect a little love for my piggies. Also I have never found an insole I actually find comfy so there that. Still love them though. I wear them out gardening in march and literally every single day when it’s raining or snowing and they’ve held up awesome. I’ll for sure buy them again. My critique is harsh and if I’m being nit picky."
So comfortable!,5.5,"Omega Taupe, Black",5.0,I love these boots. I put them on the first time and wore them all day. They are true to size. I usually wear a 5 in most shoes but I typically go up to a 5.5 for boots to leave room for thicker socks and 5.5 fit me perfectly. Love the color and the match with everything to.
SO cute and perfect for winter days!,10,"Stone Green, Black",5.0,"I first spotted these boots at a major retail store, but unfortunately, they didn't have my size. Turning to Amazon proved to be a stroke of luck, as not only did I find the perfect fit, but they also came at a slightly lower price. However, I must express a bit of disappointment regarding the lack of cushioning on the inside. The absence of substantial support can make them uncomfortable during extended periods. Overall, these boots have exceeded my expectations and are undoubtedly worth every penny."
Love the look of these,7,"Fawn, Sea Salt",5.0,"I liked these so much I bought them in grey too! Be advised the grey ones are kinda sparkly which I wasn’t expecting. See pic

I originally saw these at a big box store but they didn't have my size, so I turned to Amazon and even better they were a little less in price. I bought these primarily for a trip to England, we will be going in their rainy season and wanted something stylish, comfortable, and light weight not in that particular order. These I feel were definitely worth the price. I have walked numerous times around the block trying to go a long distance to make sure they will hold up on the streets of London and I think they will definitely deliver. They come in a variety of colors and paired with some thicker socks I hope they will be perfect."
They're as cute as they look!,7,"Dove, Sea Sprite",5.0,"I love everything Sorel makes. These are no exception- but order up a 1/2 size if you want to be comfortable. I wear a 6.5 in their wedge sandals, and a 7 in anything with an enclosed toe, or boot. These boots are light weight, easy to take on an off, and feel nice. So far I've only tested them in the coldest temps so far this year (about 20 degrees) and my feet weren't cold. I probably wouldn't reach for them if it's below 0 due to the gap around the ankles."
"The boot is very nice, although they defiantly need real good breaking in which I cannot",8.5,"Vintage Pink, Gum 16",4.0,"I’ve purchased Mandy sorel boots, all of which were comfy when you first slipped your foot into them , these were not like those."
Love love love!,10.5,"Vintage Pink, Gum 16",5.0,These babies are so cute! I love them they’re very comfortable. I can string them loose so I can slip them off and on. They work great for low snow days.
Comfy and Cute,8.5,"Black, Sea Salt",5.0,"Waterproof and fit over my cankles comfortably! Make sure you order a half size up as others have suggested.
Wore them all day today with no blisters or rubs. Still comfortable!"
Comfortable,9,"Taffy, Black",5.0,They are the most comfortable and warm short boot. They are fashionable. I have had numerous people comment on them asking where I got them. Very well made. Worth the money
This is a Christmas gift,7,"Taffy, Black",4.0,They look great. I hope they fit the person I'm giving them to.
My new favorite shoe,9.5,"Taffy, Black",5.0,"These shoes are awesome! I am a hair stylist and on the very first day I got them, I wore them ALL day and my feet didn't hurt at all. They are so comfortable and so cute."
Great Looking Boot,6.5,"Black, Grill",5.0,I bought these boots because they are waterproof. As soon as I put them on I knew they would be perfect. I bought a 1/2 size up. They are easy to get on and off. They are super comfortable. I am very pleased with my purchase.
Cute shoes wish I was younger,8.5,"White, Cyber Yellow",5.0,The fabric is nylon which is different then the other shoes. They were too bright white for me to pull off but cute. I wish I lived them. I bought another color.
True to size maybe a little to much tongue 👅,8,"Camel Brown, Black",4.0,"Comfortable. True to size. Great color goes great with leggings. The tonge gets a little bunched up when tying tight. Once worn more it’ll probably soften up and lay flatter.
If we ever get snow maybe I’ll get another color:)"
Christmas Gift,8.5,"Taffy, Black",5.0,The boots are a Christmas gift for my granddaughter! I’m sure she’ll love them!!
So comfortable!,7,"Sea Salt, Black",5.0,"This is my second pair of shoes from Sorel and I am obsessed! These are super comfy, so cute, and keep your feet warm and dry. Fit true to size."
In & Out Boot,10,"Dove, Sea Sprite",5.0,"Gift for my daughter. Going to give wsva Christmas gift. They run small. Usually wears size 9. Bought 9 1/2. Toe hit front of boot. Reordered size 10. They fit perfectly!
Bought for a teacher who travels between schools throughout the day and does not have the time or convenience to change boots/shoes at each school. These are perfect for outside and inside for Wisconsin winters."
So cute!,9,"Camel Brown, Black",5.0,These are adorable! I would go a half size up. I wear an 8.5 but ordered a 9 and they are great! Stylish and keep my feet dry/warm.
With winter boots always buy brand name,10,"Camel Brown, Black",5.0,"Everything about this waterproof boot is top notch. The style is trendy, the way it’s made, all pros."
Meoooww,NA,NA,5.0,"These are good looking boots, super comfortable, love the features (waterproof). My only downside is the stitching hits my right great toe bunion, which hurts, but isn’t the shoe’s fault."
"Comfortable, Cute and Warm",7,"Omega Taupe, Black",5.0,"I love these! I bought them for a trip to the mountains. They were warm, durable and the fact that they are waterproof was very helpful."
Great multi-purpose shoe. Love them!,7,"Camel Brown, Black",5.0,"This boot is a great cross over shoe. It works at the dog park and in the snow. It is stylish and comfortable yet keeps my feet war, and dry. In the often-crowded field of winter footwear, Sorel's Out 'N About III Classic Boot for women makes an indelible mark, blending quintessential craftsmanship with innovative design. Consider this the Tesla of winter boots, if you will—engineering and style coexisting in perfect harmony.
Ergonomically designed, the boot seems to whisper, ""Go ahead, conquer that mountain—or at least that snowy parking lot."" The archsupport could be likened to a business mentor: always there to guide you, adding confidence in each step. The traction is remarkable, an excellent safety feature that could be equated to a market risk assessment in its ability to mitigate slip-ups."
Perfect,8.5,"Stone Green, Black",5.0,"Cute dress up or dressed down. Super functional. I live in Wisconsin and wear them pretty much every day all fall, winter, and spring. They keep you warm and dry without overheating your feet."
Great boots!,8,"Dove, Sea Sprite",4.0,"Super comfy and cute! Love that I can slip them off and on. Warm enough when it's not crazy cold, otherwise I recommend wearing wool socks with these boots and then it's perfect!"
Love them,9.5,"Stone Green, Black",5.0,These boots are so comfortable and warm. I’m obsessed with them. Looking into another style already. Worth the penny.
Super cute!!,7.5,"Camel Brown, Black",5.0,"I love how cute these boots are! They don't have a ton of arch support or cushion but nothing that insoles can't fix. They aren't uncomfortable by any means. I have narrow high arched feet. I usually wear a 7.5 so I ordered a 7.5 and 8. The 8 fit better. The 7.5 wasn't super tight but too close to my great toe. I love these boots because they are so cute! I just got them today so, so far I recommend. If I experience any issues, I'll update my review."
"Super cute , size up 1/2",8,"Camel Brown, Black",5.0,I ended up sizing up a 1/2 size. Very comfortable
Easy to get on and off. Loo great. Comfortable and well built.,7,"Camel Brown, Black",4.0,Comfortable and easy to get on and off. Really pretty. Very well built.
Sorel brand fave,8.5,"Camel Brown, Black",5.0,Great weather proof boots that look really cute!
Must Buy!,10,"Taffy, Black",5.0,"So cute, stylish, and comfortable! They look great on and make my feet look smaller than they are. As with all of my Sorels, I suggest going a half size up."
Warm,7.5,"Omega Taupe, Black",5.0,"I got to do the try me with these shoes, they are absolutely perfect!!! The temperature where I live has been below 30 degrees and these shoes have kept my feet nice and warm and extremely comfortable!! I also walked through some snow and my feet reminds nice and dry."
Sorel’s,8.5,"Camel Brown, Black",5.0,Super cute and waterproof:) can’t wait for winter now.
"Love, love, love",7.5,"Omega Taupe, Black",5.0,I love these boots they’re waterproof. I get compliments on them all the time highly recommend.
So cute and comfortable!,9,"Taffy, Black",5.0,So cute and super comfortable! You can dress them up or down and they go with everything!
Great shoes!!,9,"Camel Brown, Black",5.0,"I waited a while to get these and now I don’t know why! I love them! Super comfy work well in all types of weather! Great fit as expected, great material! Would buy again."
Warm,9.5,"Stone Green, Black",5.0,Perfect fit and looks great
"Love the look of these boots, but sole separated",7.5,"Camel Brown, Black",4.0,"These were some of my favorite boots; the style and fit are superb! Unfortunately, the rubber soles started to peel away from the boot in the back of both."
Price is for the look and name brand,10,"Camel Brown, Black",3.0,"I tried these shoes on in a store where I decided that they were roomy enough to go down a half size. After I received mine from this listing, I was surprised they were too small. I'm also a little annoyed that the tongue of the shoe is a bit small. They don't lay flat, and is shorter than the top of the shoe. I definitely recommend insoles as well."
water proof,7.5,"Vintage Pink, Gum 16",5.0,"I like walking during the rainy day but my feet always got wet. As soon as I got these shoese, I tried to walk my neighbor but I didn't get wet at all. They are a little bit heavier than I thought but still good."
Awesome Boots!,7.5,"Camel Brown, Black",5.0,I love these boots! I wore them to an outdoor event over the weekend and it was rainy. These boots don’t even look like I wore them. Amazing!
Love these!,NA,NA,5.0,Warm and Cozy.
Sizing is weird,8.5,"Camel Brown, Black",5.0,I order an 8.5 (normal size) but they felt a little small so I ordered a 9 and they are way to big. However that are so freaking cute!
"Run small, otherwise love",NA,NA,4.0,"Normally wear 9.5 or 10. I’ve tried these in 10 and 10.5, should have ordered 11.
Otherwise very comfortable, love the style."
Hard boots and fit is not right,5.5,"Omega Taupe, Black",3.0,"The sole is nice and thick, but it doesn’t fit me as well as I was hoping. Despite how the shoes appear, they actually don’t bend much at all. These are hard boots. Also, the toe is upturned too much. Maybe it’d fit better if I had a half size larger."
Runs small,8,"Camel Brown, Black",3.0,ORDER UP A FULL SIZE. Not true to size. I wear a 7.5 and ordered up a half size (8) to accommodate thick socks. These fit like a 7.
Cute but…,8,"Camel Brown, Black",3.0,"I think these boots are so cute! Once they arrived, I was pretty disappointed with the comfort they DONT provide. They feel stiff, they dont offer support and there is very little cushioning in the insole. That said, if you are looking for boots to wear casually and not for a lot of walking they are very cute. For short distances, they are fine, I just wouldn’t want to be stuck in these if I had a big walk ahead of me!"
Comfortable,8,"Canoe, Light Bisque",5.0,Love these. True to size and comfortable
Mostly alright,9.5,"Camel Brown, Black",3.0,"Runs small, a little narrow in the toe box."
AMAZING!!!,8.5,"Camel Brown, Black",5.0,"I actually bought these shoes because I was going on a cruise to Alaska and had planned on doing a lot of walking. THEY ARE TRULY AMAZING! They saw all of Skagway, all of Juneau, all of Icy Straight Point and I had no issues whatsoever. They are super cute and very stylish."
Comfy & Cute,NA,NA,5.0,Love these waterproof boots that are so comfy and cute! Lots of warmth.
Well made! Comfortable,9,"Taffy, Black",5.0,These are very durable!
Runs short,9.5,"Omega Taupe, Black",3.0,"Love these boots, but they run short. Ordered my regular size but my toe hits the front of the boot. Returning and ordering the next size up"
"Cute, but not comfortable",12,"Taffy, Black",3.0,"These are a cute style. Make your feet look small. The toes are very stiff. Not very comfortable. Slip on, and feel loose… no padding. I took the advice of other reviews and sized up, but I would not recommend. True to size."
Not the same,10.5,"Black, Grill",3.0,These fit however there’s not much cushioning on the bottom and the sides of the boot rub against my inner ankle. These two things combined only makes these ideal for running quick errands.
Little super boots,7.5,"Camel Brown, Black",5.0,"First off I love Sorel boots generally… I have their original Joan of Arcs and two pairs of their suede ankle boots. I bought these for a trip I’m taking in spring to Japan where there will be snow/ lots of walking. In an effort to break them in I took them on a ski trip to Mammoth and figured they’d keep me warm in the car bc I’m always cold.
They are sooo warm and soo lightweight… like running shoes light weight. They do run a tad small so I went up a half size. I suggest wearing with socks that cover your ankle as they can rub a bit like high tops. As for waterproof… they are AMAZING. I literally got out of the car in slushy snow that went nearly to the top… no water went inside and the inside stayed really dry. The outside dries relatively fast and they don’t show dirt easily/clean up easily. They have a nice removable/washable sole. You can lace them tight or loose if you want more of an Ugg boot pull on/off feel. They are super walkable. I only gave 4 stars for support because they are not as supportive as other boots."
too small! size up!!,7,"Omega Taupe, Black",3.0,"I'm going to have go return these, my toes are scrunched at the top. I'm a true 7 with narrow feet, and would probabley need an 8 in these. the reviews on comfort were 50/50, seems like they might be pretty comfortable if I got a pair that fit. I don't know yet if I will trade or just return. They are cute though!"
Run small,8.5,"Dove, Sea Sprite",4.0,The shape of the toe box kind of smashed my toes. I exchanged for a larger size than normal and they fit better.
Lovely,9,"Camel Brown, Black",5.0,"Fit great, good traction"
Comfortable and Stylish,9,"Taffy, Black",4.0,"I bought this boot because I love the style and am a fan of the brand. While comfortable, it does not seem like the type of boot you want to go hiking in as the sole doesn’t have enough traction."
"So cute, but so not comfy",8,"Camel Brown, Black",3.0,"I love these boots so much for the look and style, but if you're looking for comfort I don't recommend buying these. The tongue is rigid and stiff which pokes into my foot, even with thick wool socks on. Bummer!"
Wearing out after 1 year,7.5,"Black, Grill",4.0,"I bought these boots January 2022 & I'm looking to replace them by January 2023. Let me start by saying I do like these boots.

But the seam is splitting on the top at the rubber/leather seam. Some of the rubber is cracking as well. I've worn them for winter weather walking in the city through snow and rain.

YES they keep my feet dry, but not warm and if tied too tightly the top of my foot has bruised.
I do like the style and I think they would keep well if you don't plan to do a lot of walking but want dry feet and a stylish boot."
Awesome sneakers,6.5,"White, Cyber Yellow",5.0,Super comfortable great quality. I ordered half size up and fits perfectly
It's a good winter boot and spring because they are water proof!,9.5,"Camel Brown, Black",4.0,"They are comfortable. They do run small like some other people were saying in the reviews. I had to exchange them for a 1/# size bigger and really should have did a whole size up because I wear thick wool socks. I also did have an issue with 1 tongue on my left boot. It started coming apart at the right corner by the lace hole. I have to push it down so it comfortable when I pull the strings tight to tie my shoe,not that big of a deal but for the price that shouldn't happen. They are waterproof,me and my dogs walked in the rain,snow an spasmed on my cars! My feet stay warm mostly if the temp is about 25° and up with sun even with wool socks,not too bad! I am starting,after a lil over 3 mths of wearing and having them that water is getting in to my boots somehow at the bottom or sides of them,feet getting wet,not cool! Warranty just bite the dust Jan 31 so I gotta eat the price and have wet feet. It was good while it lasted! Would recommend!"
"Super cute, not super comfortable",8.5,"Camel Brown, Black",3.0,"Love the look of them, but they weren’t very comfortable (especially around the ankle)."
Great throw on boot for running around,8.5,"Omega Taupe, Black",4.0,These boots come just above the ankle. They are waterproof so no rain spots. They are comfortable. While there is no fluffiness inside the boot there is thin fabric and it does keep your feet warm. I have worn them in spring and cold weather and with warm socks in the winter they keep your feet toasty. These are good for rain days for sure or just to throw on and run around in on average day. I have not worn them in snow yet but have in cold weather. I walked a few miles at a time in them with no discomfort at all. The sole keeps a nice distant between you and the cement so you can’t feel the cold of the cement. Great product. I took one star off because mine had a small stain on it right out of the box. My photos are after wearing the boots several times. I wear a size 8 and got an 8.5 because I wanted room for thicker socks. They are perfect however I believe an 8 may have worked as well but am happy with my 8.5. If I bought again I’d stick with the 8.5. Hope this helps.
Great boots,9,"Omega Taupe, Black",5.0,"Really nice winter boots, stylish and comfortable"
great for when it rains,9.5,"Omega Taupe, Black",4.0,"I needed a replacement because the rubber stripe that goes around the bottom edge was
separating AND water was starting leaking in. I have the other boots ready to return."
no support but cute,7.5,"Camel Brown, Black",4.0,"update - 3 months in and these are tearing apart at the sole! for the price, i definitely expected better quality. i rarely wear these more than to and from work (change shoes once i get there) so for them to be doing this already is nuts.

had to go up half a size and there is zero support in these. I'll have to get some insoles for them. I walked a lot in them the past couple days and it was not comfortable."
"Love the style, not as comfortable as I’d hoped.",9,"Camel Brown, Black",4.0,This boot was meant to go with me to Switzerland to walk around the cities and get me up the Alps. I was looking for a sneaker like boot. Something stylish and comfortable. While cute this wasn’t very comfortable or provide much support. It will be left home but I will wear on rainy or snowy day here.
Cute But Not Comfortable,9,"Taffy, Black",2.0,"Very cute boots, seem to repel water from the small amount of rain they were worn it but were VERY uncomfortable. Very flat boot, little support, little cushioning, foot slides forward every so slightly causing toes to be pressed together and hurt. Even tried pulling their insole and using a Dr Scholls to add more support and padding and they still were not comfortable in the toe box. Also tried sizing down a half size from my regular Sorel size and still a no go. Disappointing coming from this brand. I got the regular shoe version as well and same thing. So both will now be a maybe wear to the office on a wet/snowy day, something where I am not moving around at all. Not ideal for the cost. These could be amazing if they'd put some effort into comfort and support as well as aesthetics."
There’s something wrong with the tongue of the shoe,8.5,"Camel Brown, Black",2.0,"I’m not the first reviewer to say this. I love these shoes - they are stinking cute but the lining of the suede tongue sticks out around the laces and you. Ant tuck it back in - it’s almost like it isn’t wide enough or something. Unless Amazon shipped me the defective one that other reviewers mention, I’d pass on this."
Comfortable but…,10.5,"Omega Taupe, Black",4.0,These boots fit better than most other Sorels I have tried. They are comfortable and warm. The only negative thing I can say about them is where the tongue is stitched to the shoe the seam is a bit bulky and does rub on the top of my foot. I did find that with a little adjustment when putting it on it can avoided
Good but not perfect,9.5,"Camel Brown, Black",4.0,The boots are waterproof which is great but they run a little small and cause a little irritation on the heels. They may just need to be broken in.
The tongue is funny,9,"Dove, Sea Sprite",4.0,Super cute! Took me a while to get them laced the way I wanted so that I could just pull them on. The area where the tongue attaches seems to be poorly designed or maybe it’s just my pair. The gray fabric part takes on a blue tint when outdoors. They are so lightweight and roomy without being floppy or rubbing my heels or ankles.
Daughter Loves this Gift,7.5,"Dove, Sea Sprite",5.0,And she can't wait to wear them on the mother/daughters trip to Ireland
Very uncomfortable!,11,"Camel Brown, Black",3.0,"These were referred to me by a friend who has a slightly older version and they are horrible! Like someone else mentioned the tongue does not sit right and rubs against the top of your foot. For this much money why are these not a dream? The style is beautiful and they are so nice to look at, but for this much money they better be comfortable! How disappointing. This is my 3rd pair of Sorel I returned in a week. I bought Eddie Bauers instead and they were like wearing a cloud. So much cheaper and SO much more comfortable! Also, I typically wear an 11 in boots, but these were really big. I could've sized down at least a 1/2 size, possibly more. My regular shoe size is a 10 though."
Awesome boot,9,"Camel Brown, Black",5.0,"I love these! I had waiting quite some time to buy them, as they are expensive, but now I am so glad that I did. They are waterproof and keep my feet warm. They are cute too. I mainly use them while hiking or walking my dogs where sometimes I have to walk through mud, puddles, or wet grass. I recently went to Oregon and used them on the beach, and they were great for that too on a cool rainy day. I have not used them in the snow, but I think that for short treks in snow, they would be good enough. Update: I've had these boots just a bit over a year and they are holding up well. I have worn them often and have not regretted my purchase a bit. An added benefit is that they do keep my feet warm, as well as dry, on my early morning walks."
