title,size,color,rating,review_text
Super comfortable and keeps feet warm,NA,NA,5.0,"Absolutely love these boots. Love that they keep my feet warm and dry. They do run a little big but will be nice to wear thick socks with. Easy to get on, keeps my feet dry and warm! Great quality and fashionable boot!"
Better than I even expected!,8,"Camel Brown, Black",5.0,These are warm but not heavy. The arch support is fantastic. I absolutely love these!! Living in the upper Midwest I need daily winter boots that aren’t bulky. These are great!
Comfort and size,10,"White, Cyber Yellow",5.0,I usually were a 9.5 and ordered a 10. Fits just right but will hav me no room for a sock. Returning and ordering a 10.5. Order a full size up if you will wear a thin to thick sock. Other than that they are comfortable and stylish.
Love,7,"Taffy, Black",5.0,These are so cute and I get so many compliments on them. Also very comfortable.
Loooove,8.5,"Camel Brown, Black",5.0,"I finally made the splurge and for myself a pair just so my feet won’t freeze wearing slip on shoes. I wear a size 8.5 and they fit perfect after being broken in. We haven’t had a lot of snow to fully test them out, but I’m sure they’ll do great."
I love these boots. They are flattering on and so warm and comfortable!,8.5,"Omega Taupe, Black",5.0,Love these boots. They are flattering on and very warm and comfortable. I bought 1/2 size bigger and it's perfect.
Order 1/2 size up if you plan to wear thick socks!,8,"Camel Brown, Black",5.0,Fantastic pair of shoes! I ordered 1/2 size up because I planned to wear thick socks and that was fine. I could probably gone up 1 whole size and been fine as well.
Must have!,8.5,"Camel Brown, Black",5.0,I purchased these a half size bigger so I could slide them on and off at work as I have to go out into the elements often but work in an office environment
Warm and Cozy in Montana Snow,10,"Camel Brown, Black",5.0,"These boots are the cutest! I've worn them with dress pants and jeans. As a realtor, I slog through some cold, wet conditions in Montana. These boots are cute and comfy. My thicker Sorel boots are better for longer times in the snow, but these are great for everyday."
Everyday winter boot,8.5,"Camel Brown, Black",5.0,"Love these boots! My daughter had some that she loves also. I have inserts from the good feet store and had to buy boots for the winter, so I bought a size up. With the foam pads and the inserts, my feet now feel great and supported, and also waterproof! Love them"
Cute and functional!,NA,NA,5.0,"I know they are not extremely warm, but they are definitely waterproof. Went thru thick wet snow this morning and my feet stayed dry! Even after walking thru about 4 inches of slush today also!"
FAV BOOTS ever,7,"Camel Brown, Black",5.0,I love Sorel and this is by far my most FAV pair ever! They go with so much and are just perfect. I ordered a half size up :-)
Comfort & Warmth all around NYC in January,6,"Camel Brown, Black",5.0,"Added an insert. Wore for a week long visit to NYC in January. Warm, dry, comfortable for hours of walking each day. Does not provide ankle support."
My New Favorite Brand,NA,NA,5.0,Although Sorels are a little bit pricey I have to say I will definitely look forward to starting a collection of them. This has been the absolutely most comfortable boot/ shoe i have worn in a very long time. The durability and water resistant is perfect for my everyday use when walking/ running my Rotti in all types of weather conditions. This shoe has the feel of a very supportive sneaker. Excellent quality and style. The unique back is eye catching as well. Enjoy!
Perfect for cold weather,8.5,"Taffy, Black",5.0,"Excellent boots. Very comfortable to walk around in during the winter. They keep the slush, snow and cold out without over heating your feet. Love these! Would get them in every color"
YES YES 🙌🏼,8,"Camel Brown, Black",5.0,Get you some now! True to size and STUPID CUTE! I have gotten so many compliments on these shoes.
Winner,6.5,"Omega Taupe, Black",5.0,Sorels always a good choice. Comfortable.
Good fit,9,"Black, Sea Salt",5.0,Good fit
Sorel ankle boot - non-skid sole - LOVE these!!,NA,NA,5.0,"Saw a friend with this boot and fell in love!! How did I live without it in WI?
Style - comfort - function.
Note - I wear thick socks in WI - order up 1/2 size."
Sorel is worth the HIPE!,7,"Omega Taupe, Black",5.0,"Super cute, comfy, and great for cold, wet weather."
Really nice and comfortable boots,8,"Camel Brown, Black",5.0,"These boots are waterproof, durable, comfortable, stylish and more I wore these in Washington on a very rainy day and they kept my feet nice and toasty. They are perfect for hiking or walking and comfort. I totally recommend."
"Stylish, true to size just gotta break them in",9,"Taffy, Black",5.0,"I have a size 9 foot and prefer “wide” when that is an option. I read many reviews saying runs small, so i was going to order the 9.5, however, was turned off that a half size up was like $50 more. After wearing these boots with regular socks, they become more and more comfortable! So happy i went with the 9s. I get compliments every time i wear them, and they add a little height to my short stature!"
Tal y como me lo esperaba,9,"Camel Brown, Black",5.0,Excelente calidad
Comfortable,10,"Camel Brown, Black",5.0,The boots are very comfortable!
The most amazing foot wear ever!,9,"Camel Brown, Black",5.0,"Light as a feather , ankle support and dirt resistant. My favorite kicks ever"
Boots,7,"Omega Taupe, Black",5.0,"Like everything about them. Looks, comfort, usage, and price."
These are great,10,"Camel Brown, Black",5.0,"I love these boots!! They are so cute and comfortable. Best of all, they slip on and off and are light weight!!"
Love these.,9,"Camel Brown, Black",5.0,"When I tried these on with the cool socks, I thought they were way too small. I then tried them on with regular cotton socks and they fit perfect. Although they’re waterproof, they do not cause sweaty feet, which was surprising."
I love these boots. Excellent quality.,7,"Dove, Sea Sprite",5.0,Very cute and the quality is excellent! They are also surprisingly comfortable!
Exactly as expected.,9,"Camel Brown, Black",5.0,No problems exactly as expected
Exactly Right,8,"Taffy, Black",5.0,"I am super happy with this product, everything was as I expected. The only comfort issue is just breaking them in. Other than that super happy with my purchase."
Love these!!,10,"Taffy, Black",5.0,So cute
Good quality product,8,"Camel Brown, Black",5.0,So cute and good quality
so cute!!,5.5,"Camel Brown, Black",5.0,"I am absolutely obsessed with these boots. I love them and wear them to walk the dogs and run errands. I don’t feel like they are fully weather proof though. I’ve had them less than 2 months with normal light wear and the rubber on the toe is already coming apart too. I wanted to exchange them but were out of my size. Really disappointed they aren’t better quality, I expected them to last years and years but they definitely won’t. Still cute though."
Love my shoes!!!!!!,8,"Omega Taupe, Black",5.0,They are so comfortable!!!! I get so many compliments too!
Stylish,9.5,"Omega Taupe, Black",5.0,Super cute
Comfortable,7.5,"Taffy, Black",5.0,Sorel are the best boots! No break in time at all. You can put these boots on right out of the box. They are so cute!
Wonderful,9.5,"Taffy, Black",5.0,"I wanted these for my daily walks with my dog, for the New England winter weather..they are perfect and very comfy like a sneaker"
Perfect boots,8,"Taffy, Black",5.0,These boots are not only comfortable and stylish but more importantly they keep my feet warm!
Great quality,10,"Taffy, Black",5.0,Didn't appreciate having a 32.00 restocking fee plus 15.00 more for a larger size
Daughter in law loves them,9,"Taffy, Black",5.0,"Good comfort, warm and water proof . Support is ok , could be better."
Very Cute!,7,"Camel Brown, Black",4.0,Super cute. Easy to wear. Comfortable and true to size.
Super cute & light weight,9,"Camel Brown, Black",4.0,"Order 1/2 size up due to previous reviews, but the normal size would have fit fine. I had to add sole inserts to make up for the looseness even with boot socks the extra 1/2 size was too much. Overall, I like a little room in my shoes so I will definitely be keeping them. Only complaint is the tongue is stiff & sort pokes the top of my foot where the tongue is sewn in. I have to position it or don’t tie the laces real tight. I have worn them all day on multiple occasions without issues."
Stiff But Cute,12,"Omega Taupe, Black",4.0,"Very stiff no arch support, but cute and I got inserts. Runs a size small, as sorels usually do. Not as tennis shoe like as they look, more like duck boots."
very good produce,9,"Camel Brown, Black",4.0,very good product
Fashion not warmth,7,"Camel Brown, Black",4.0,"These boots are super cute and I get a ton of compliments every time I wear them. They’re perfect for running errands and look stylish. However, they are not ideal for warmth especially if you live in the north or actual cold temperature regions. I would buy them again as they are great when you are moving around or just want dry feet. Not warm enough for a cold ice rink or cold temperatures."
Stylish and comfortable for med-wide feet,9.5,"Camel Brown, Black",4.0,"I love these boots. They're really cute and comfortable. I would say if you're considering buying them, to purchase a size up. I normally wear a 9.5, but had to reorder a 10. I'd also add that these are a good boot for folks with medium to wide feet. I've got narrow feet and have to double up on socks."
Not quite enough insulation for Minnesota winter!,7,"Taffy, Black",4.0,Little too stiff and needs more insulation.
These run about a half size small,11,"Taffy, Black",4.0,These are a good boot not the most comfortable shoe but these run a bit small. I'm an 11 and these feel more like a 10.5. Mine were used when I ordered them new. They were a return and it was obvious when I opened the box right away. Tags were off and soles were not clean ect. So not a great shoe for long walks but they look nice and keep your feet dry!
Near perfect…,8,"Camel Brown, Black",4.0,"I love the style, color, comfort, small elevation from the heel and durability/water resistance. Near perfect with a few suggested adjustments: I hate the visible seam on the tongue… it doesn’t sit under the laces and I actually wish there were no laces, but instead elastic bands to provide for quick pull on and off. Still those are minor and these are still my fave cold/wet weather shoes."
Boots are stylish,7.5,"Black, Grill",4.0,"These are good boots to keep your feet dry and warm.
If you want to wear thicker socks - size up - they are a bit snug in the toe area. Not great arch support - I had to add an arch support insert- careful not to intrude on toe area tho - arch support was only in arch area. Not as big and bulky as other warm boots which is why I liked them."
New favorite boots until they broke,NA,NA,4.0,"I have always loved the look and quality of Sorel. My other 5 pairs have lasted years. This pair was great, able to wear casually and for walks/hikes. Unfortunately after mild wear for 3 weeks the strap that holds the top lace broke off. So disappointed. I don’t feel like I should have to pay to repair a basically new boot but now they are back ordered."
Great looking shoe with zero support,9.5,"Omega Taupe, Black",4.0,"I loved the look of these boots. Easy on and off. Perfect for snowy/rainy springs and fall weather. My only complaint is they have zero support and if on m feet for long period, shopping, etc. my feet and legs ache."
Cute and waterproof,6.5,"Black, Sea Salt",4.0,Looked forward to receiving these .. wore them right away for a couple of weeks — toes started to hurt.. they are too small. Order a 1/2 to full size up.. also there is no provision/cushion for the foot pad area in front.. your foot can feel the ground .. I would buy again but not without right insert and definitely a size larger .
"Well made, but runs small...",7.5,"Black, Grill",4.0,"Great shoe. Very well made. Ordered my usual size, 7.5. But... they were too tight. My toe was right up against the toe box. Width was fine. I have ordered an 8 and hope they will be a perfect fit."
Very comfortable boots.,9,"Taffy, Black",4.0,Very comfortable boots and water resistant. However I do wish Sorrel would have made the toe box larger. It would have added comfort and a better look to the boot. Overall I am happy with my purchase!
Scratches,9,"Taffy, Black",4.0,"The boots came with a couple of scratches on them but otherwise they were fine. I wear between an 8 1/2 and a 9, and am glad I bought the size 9."
Not completely water resistant go up a half size,7,"Camel Brown, Black",4.0,I love sorel boots and sneakers. These are terrific but they do leak a little with a lot of water and I had to go up a half size
Wish they laced better,9.5,"Black, Sea Salt",4.0,"They look great and the size is as expected, but because the material around the ankle is so thick the laces don't allow them to actually fit tightly around the ankle so the foot slides around inside, feels like there's not enough room for my toes when I'm walking."
Great look and quality!,9.5,"Black, Grill",4.0,"I only gave it 4 stars because it hasn't snowed here yet. But from what I know of Sorrel, I'm sure they will be fine. They are very comfortable."
Cute but not comfortable,12,"Black, Grill",4.0,"These boots are super cute, and true to size. However, they are not very comfortable and I will probably not wear them very much due to that reason."
Super cute but size is up,9,"Black, Sea Salt",4.0,Love these casual boots but they seem to run a little small. I am a solid 9 in most brands (including other SOREL boots) and my toe hit the front of these. Sizing is definitely a bit off. I returned and ordered a half size larger - hoping that works!
Runs small,7,"Black, Sea Salt",4.0,These shoes are very nice looking. They are super lightweight and comfortable. I’m glad I read the reviews because these shoes run VERY small. I’m a 6 in sneakers and 6.5 in boots. I’ve bought these in a size 7 and they’re just big enough.
"Good looking shoe,",8.5,"Camel Brown, Black",4.0,", not for someone who has foot issues - no support in the soles."
Expensive but nice boot,7,"Camel Brown, Black",4.0,Don’t go in to deep of water
So comfortable!,8,"Camel Brown, Black",4.0,Purchased as a Christmas gift to use during holidays. Will update when I know more.
A little tight in the forefoot.,9,"Camel Brown, Black",4.0,They are tight in the forefoot but will probably be okay in successive wearing.
I have another pair also,NA,NA,4.0,I like the new colors. Always have a pair or two in my closet
Love them!!,7,"Camel Brown, Black",4.0,I love these boots!
Comfortable,8.5,"Camel Brown, Black",4.0,Comfortable and true to size.
"Nice quality, a bit bulky",8.5,"Black, Sea Salt",4.0,"Fast ship, nice quality, a bit heavy and bulky"
Great for rain + snow,9,"Camel Brown, Black",4.0,"Super cute booties for rain + snow! They’re comfy, waterproof, lightweight, + warm. I’m normally a 5.5 or 6, but I would recommend going a half size up if you would be wearing thick socks with these."
Weirdly a lot smaller than my other Sorels,10,"Camel Brown, Black",4.0,"I was so excited to get these (they are soooo cute), but they are weirdly a lot smaller than my other Sorels that are the same size (both size 9, pictured). I reordered the next size up (9.5) and am hoping they work because they seem great other than that!
UPDATE: The 9.5s came in and they fit! So, I recommend sizing up a half size."
Cute! But not really a cold weather/winter boot,NA,NA,4.0,"Cute boot! I ordered a 7 which is my usual size. I probably should have gone up 1/2 size up for two reasons: (1) I have one foot that is slightly bigger than the other. The first several wears, my big toe was hitting the top of the boot. Now that its a bit more broken it, I don't notice so much. (2) Thicker socks. These boots are not all that warm. In temps below freezing, I can feel my toes getting cold even with what should be warm enough socks. If you're looking for a winter boot/shoe, this may not be it. But if you're looking for a light weight, waterproof, can-get-dirty, type of boot - this is the one."
Needs more cushioning,NA,NA,4.0,"Saw the good reviews so decided to order for an Ohio winter. Overall this is a good boot but runs slightly small. The tongue doesn’t lay flat and there is barely any cushioning in the sole. I wouldn’t want to walk far in these, but they are ok for running errands. On a positive note they are very warm."
"Cute, comfortable, but won't keep your feet warm .",9,"Camel Brown, Black",4.0,"I love how these boots look and they are comfortable but with in a minute of being out in the snow my feet were freezing. So, if your looking for boots that will keep your feet warm, I would say these are not what you should get."
ORDER ONE SIZE UP!!!,10.5,"Camel Brown, Black",4.0,"I wear a 10...I went to DSW to try them on, but they only had an 11, which I tried on (with ""regular"" socks) and thought they were too big...So, I ordered a 10.5 from Amazon.

Once, I tried them on with winter socks , they were even to small...My toe was right at the tip of the shoe!!!

Going up and half size, didn't work for me...GO UP ONE WHOLE SIZE!!!

Exchanging for the 11 because they were super cute on!!! ENJOY!!!

EDIT!!! The 11 is right!!! Aye!!!"
"runs a tad small, especially with thick socks",7,"Camel Brown, Black",4.0,"love it, just returning for a half size bigger"
Size-Up,9,"Camel Brown, Black",4.0,Super cute shoes! Not much foot padding and no arch support but still comfortable. Purchased a 1/2 size larger than I normally wear and they fit perfectly.
Nice boot - size up,NA,NA,4.0,"I really liked the boot. I tried on my normal shoe size and 1 size bigger. I definitely needed to go with the larger size. One thing to note, there is NO arch support in this boot. if you are planning to wear for a prolonged period of time i recommend getting a sole insert with arch support. Other than that the boot is very cute. I got the grey with tan leather accents and they are really cute. I did not feel like the boots were overly heavy."
Great Shoe - Runs Small,7.5,"Camel Brown, Black",4.0,"Love these boots. Definitely not the comfiest show ever, especially if you are in the mountains but for sure a durable boot. If you plan to wear warm socks with them I would size up."
NA,8,"Camel Brown, Black",4.0,"While these boots will probably not be warm for long this winter, I kept them anyway, because they are adorable. I have a size 8 foot and sometimes I feel like boots make my feet look huge. These ones do not. I won’t be able to wear very thick socks with them as they are on the smaller side for the size."
NA,9,"Omega Taupe, Black",4.0,"These will be nice and warm for the winter, but not much support. I do a lot of walking in the winter so I will need to purchase some insoles. Kinda surprising considering the price of these boots."
NA,9,"Taffy, Black",4.0,Love them I’m hoping to wear them in and they stretch a little.
NA,9,"Camel Brown, Black",4.0,"I got the grey, brown and black shoes and they fit normally. I wear 8.5, but so many people mentioned they were small so I got a 9. 9 is big on me, 8.5 would have been perfect. Oh well.

Pros: I've ended up keeping the size 9 because the 8.5 is more than $300 for some reason.
But they are lightweight and comfy. I walked around in them for a few hours inside and outside (2 degrees celsius), and my feet were dry and warm the entire time.
They are really cute and different looking.

Cons: you can't tighten the laces to fit your foot size, the tongue just wrinkles up, as it is sewn into place. You can only tighten the top loop so they at least stay on your feet."
NA,9,"Camel Brown, Black",4.0,"I usually wear an 8.5/9 so I ordered the 9 based on other reviews to size up. My toes still touched the end on my larger foot and I actually found them to feel a bit like a Kleenex box on my foot at first, but as I have worn them they have stretched out a bit and formed to my feet and are super comfy! Breaking in nicely with no blisters or sore spots yet. They’re warm, although only tested in fall Alberta weather - hopefully they’re still warm in winter. So overall, I’m pleased with my first online shoe purchase!"
NA,8,"Taffy, Black",4.0,A great boot for work. Comfortable enough to get through a work day and my feet don't over heat. The grips are a little sucky so not great for icy weather. There is a slight improper sewing job on one of the tongues that bothered me in the beginning.
NA,8,"Black, Grill",4.0,"Fit is good - I usually have problems with bunion on one foot so it’s good that it is deep and wide enough in front.
It is not as well insulated as expected but I’ve had no problems with being out for an hour or more with temperatures around 0C."
NA,10,"Omega Taupe, Black",4.0,"J’aime beaucoup le look, j’aurais aimé que les lacets soient élastiques, on ne pouvait pas voir sur la photo que c’étaient des lacets conventionnels… j’ai bien peur qu’elle ne soient pas assez chaudes pour des températures canadiennes en hiver!"
NA,8,"Black, Grill",4.0,Perfect shoe for fall but very small sizing.
Just ok boots.,8.5,"Camel Brown, Black",3.0,"Love the boot. But have to give 3 stars. The rubber came detached from the boot in a few places after wearing them only few times. Not on only one boot, but both boots. I wasn't too happy after what I payed for them."
"In the end, good boots",NA,NA,3.0,"Originally bought a pair, but after 2 months they began leaking, which these boots are NOT supposed to do. I contacted sorel customer service but because I purchased on Amazon they couldn't help me. I expressed my disappointment with their product regardless of retailer. Anyway, I returned the first set and bought another set, and it's been 4 months of wear and they're fine. My only other complaint is that the white sole does not clean easily. Otherwise love these. Next time, I will purchase directly from sorel, not Amazon."
Sorel hit the mark with looks but uncomfortable,9.5,"Omega Taupe, Black",3.0,"Normal size 9.5… could’ve got a 10
Good looking boots but the insole is not worth the price tag. Going to buy inserts. I do not have foot issues, so it’s the boots!!!"
Great boots,8.5,"Omega Taupe, Black",3.0,"I love these boots, they are so comfy and stylish. The only issue is that the rubber sole is coming away from the shoe. The return window is closed so I have to live with it or glue it back. Not what I would expect from Sorel."
This product runs small in length. Size up! The tongue doesn't lay down smooth on sides.,7,"Omega Taupe, Black",3.0,This product runs small be sure to size up! The tongue also doesn't lay flat on each side may be uncomfortable while wearing. Will be returning
Shoes,9,"Taffy, Black",3.0,Have only worn these a few times and the cream part of the sole of the shoe is coming detached. Still really like the shoe but feel like my foot might get wet if it is wet outside.... disappointing
Fit,9.5,"Black, Grill",3.0,Although I have several other pairs of Sorel boots all in size 9.5. I was VERY disappointed when these FINALLY came as they run small and didn't fit.
Very narrow,8,"Omega Taupe, Black",3.0,They were cute but very narrow in the toes. Had to return.
Worn out after 1 year,NA,NA,3.0,I love the style and fit. I wore them for the spring and winter season in MN and after a year they started splitting at the seams in the front. The bottom also wore through and I can’t wear them any longer. Really bummed the quality isn’t what I expected from sorel.
Love these boots!,10,"Omega Taupe, Black",3.0,"Love these, comfy & perfect for everyday winter weather. Will buy again!"
Cute but not as expected,9.5,"Fawn, Sea Salt",3.0,These are definitely cute but not the quality I would expect from sorel. The boot insert doesn’t give you much support or cushion at all. I will probably be getting new inserts. Also the upper part of the boot is thin without any padding to make them a cozy winter boot. I’m a bit disappointed for the price point that sorel didn’t make these boots a little better quality. I usually wear a 9 but sized up to a 9.5. Sorel usually runs a bit small.
Tongue is screwed up,9.5,"Omega Taupe, Black",3.0,I think for 130 dollars the workmanship could be better. The tongues don’t lie flat no matter what I do. Other than that I do like them.
Sole is falling apart.,7,"Black, Grill",3.0,"Play Video
 This is my second pair of these I use them for slipping on to take my kids to school. Haven't had this pair for 3 weeks and lightly worn as we are not having rain yet for the season and the sole is falling apart. Not impressed."
Runs small,7.5,"Camel Brown, Black",3.0,These boots came and were too small. I ordered a half size up and they were still too small. I won’t purchase again:(
Sole is separating after 6 weeks of use,9,"Camel Brown, Black",3.0,The sole separate from the front of the boot - very disappointing seeing that these are work boots and $125+
Different Fit,8.5,"Black, Sea Salt",3.0,Tongue is loose and can’t be tight to your feet.
Cute boots - but Form over function.,9,"Camel Brown, Black",3.0,"These booties are really cute and comfortable enough (they aren’t uncomfortable). They’re great for keeping your feet warm and dry as long as you’re not in much snow (any more than an inch or two and you’ve got snow in your boots). The soles do not have good/any traction, so be extra careful when it’s slick out.

I usually wear and 8.5 and that was too small when I put med-thick socks on. Upsized to a 9 and they work great with thin or thick wool socks."
